[
  {
    "question_id": "Q001",
    "question": "Người sử dụng lao động có quyền áp dụng hình thức xử lý kỷ luật sa thải trong những trường hợp nào?",
    "category": "single_article",
    "gold_sources": [
      {
        "document_id": "BLLD_2019",
        "article_number": "Điều 125",
        "chunk_ids": [
          "BLLD_2019_Điều125_Khoản1_167",
          "BLLD_2019_Điều125_Khoản3_168"
        ]
      }
    ],
    "reference_answer": "Căn cứ theo Điều 125 Bộ luật Lao động 2019, hình thức xử lý kỷ luật sa thải được người sử dụng lao động áp dụng trong các trường hợp: 1. Người lao động có hành vi trộm cắp, tham ô, đánh bạc, cố ý gây thương tích, sử dụng ma túy tại nơi làm việc; 2. Có hành vi tiết lộ bí mật kinh doanh, bí mật công nghệ, xâm phạm quyền sở hữu trí tuệ của người sử dụng lao động, có hành vi gây thiệt hại nghiêm trọng hoặc đe dọa gây thiệt hại đặc biệt nghiêm trọng về tài sản, lợi ích của người sử dụng lao động hoặc quấy rối tình dục tại nơi làm việc; 3. Bị xử lý kỷ luật kéo dài thời hạn nâng lương hoặc cách chức mà tái phạm trong thời gian chưa xóa kỷ luật; 4. Tự ý bỏ việc 05 ngày cộng dồn trong thời hạn 30 ngày hoặc 20 ngày cộng dồn trong thời hạn 365 ngày tính từ ngày đầu tiên tự ý bỏ việc mà không có lý do chính đáng.",
    "requires_refusal": false
  },
  {
    "question_id": "Q002",
    "question": "Thời giờ làm việc bình thường của người lao động được quy định tối đa bao nhiêu giờ trong một ngày và một tuần?",
    "category": "single_article",
    "gold_sources": [
      {
        "document_id": "BLLD_2019",
        "article_number": "Điều 105",
        "chunk_ids": [
          "BLLD_2019_Điều105_139"
        ]
      }
    ],
    "reference_answer": "Theo quy định tại Điều 105 Bộ luật Lao động 2019, thời giờ làm việc bình thường không quá 08 giờ trong 01 ngày và không quá 48 giờ trong 01 tuần. Người sử dụng lao động có quyền quy định thời giờ làm việc theo giờ hoặc ngày hoặc tuần; trường hợp theo tuần thì thời giờ làm việc bình thường không quá 10 giờ trong 01 ngày và không quá 48 giờ trong 01 tuần. Nhà nước khuyến khích người sử dụng lao động thực hiện tuần làm việc 40 giờ đối với người lao động.",
    "requires_refusal": false
  },
  {
    "question_id": "Q003",
    "question": "Số giờ làm thêm của người lao động được quy định bảo đảm không quá bao nhiêu giờ trong một ngày và trong một tháng?",
    "category": "single_article",
    "gold_sources": [
      {
        "document_id": "BLLD_2019",
        "article_number": "Điều 107",
        "chunk_ids": [
          "BLLD_2019_Điều107_Khoản1_141",
          "BLLD_2019_Điều107_Khoản2_142",
          "BLLD_2019_Điều107_Khoản3_143"
        ]
      }
    ],
    "reference_answer": "Căn cứ theo Điều 107 Bộ luật Lao động 2019, khi tổ chức làm thêm giờ, người sử dụng lao động phải bảo đảm: số giờ làm thêm không quá 50% số giờ làm việc bình thường trong 01 ngày; trường hợp áp dụng quy định thời giờ làm việc bình thường theo tuần thì tổng số giờ làm việc bình thường và số giờ làm thêm không quá 12 giờ trong 01 ngày; không quá 40 giờ trong 01 tháng.",
    "requires_refusal": false
  },
  {
    "question_id": "Q004",
    "question": "Lao động nữ sinh con được nghỉ chế độ thai sản trước và sau khi sinh là bao nhiêu tháng?",
    "category": "single_article",
    "gold_sources": [
      {
        "document_id": "BLLD_2019",
        "article_number": "Điều 139",
        "chunk_ids": [
          "BLLD_2019_Điều139_Khoản1_184",
          "BLLD_2019_Điều139_Khoản3_185"
        ]
      }
    ],
    "reference_answer": "Theo quy định tại Điều 139 Bộ luật Lao động 2019, lao động nữ được nghỉ thai sản trước và sau khi sinh con là 06 tháng; thời gian nghỉ trước khi sinh không quá 02 tháng. Trường hợp lao động nữ sinh đôi trở lên thì tính từ con thứ 02 trở đi, cứ mỗi con, người mẹ được nghỉ thêm 01 tháng.",
    "requires_refusal": false
  },
  {
    "question_id": "Q005",
    "question": "Người lao động làm việc theo hợp đồng lao động xác định thời hạn có quyền đơn phương chấm dứt hợp đồng lao động phải báo trước bao nhiêu ngày?",
    "category": "single_article",
    "gold_sources": [
      {
        "document_id": "BLLD_2019",
        "article_number": "Điều 35",
        "chunk_ids": [
          "BLLD_2019_Điều35_Khoản1_48",
          "BLLD_2019_Điều35_Khoản2_49"
        ]
      }
    ],
    "reference_answer": "Căn cứ theo Điều 35 Bộ luật Lao động 2019, người lao động có quyền đơn phương chấm dứt hợp đồng lao động nhưng phải báo trước cho người sử dụng lao động ít nhất 30 ngày nếu làm việc theo hợp đồng lao động xác định thời hạn có thời hạn từ 12 tháng đến 36 tháng; ít nhất 03 ngày làm việc nếu làm việc theo hợp đồng lao động xác định thời hạn có thời hạn dưới 12 tháng.",
    "requires_refusal": false
  },
  {
    "question_id": "Q006",
    "question": "Người sử dụng lao động có quyền đơn phương chấm dứt hợp đồng lao động trong những trường hợp nào?",
    "category": "single_article",
    "gold_sources": [
      {
        "document_id": "BLLD_2019",
        "article_number": "Điều 36",
        "chunk_ids": [
          "BLLD_2019_Điều36_Khoản1_P1_50",
          "BLLD_2019_Điều36_Khoản1_P2_51",
          "BLLD_2019_Điều36_Khoản2_52"
        ]
      }
    ],
    "reference_answer": "Theo Điều 36 Bộ luật Lao động 2019, người sử dụng lao động có quyền đơn phương chấm dứt hợp đồng lao động trong các trường hợp: a) Người lao động thường xuyên không hoàn thành công việc theo hợp đồng lao động; b) Người lao động bị ốm đau, tai nạn đã điều trị trong thời hạn quy định mà khả năng lao động chưa hồi phục; c) Do thiên tai, hỏa hoạn, dịch bệnh nguy hiểm hoặc địch họa mà người sử dụng lao động đã tìm mọi biện pháp khắc phục nhưng vẫn buộc phải thu hẹp sản xuất, giảm chỗ làm việc; d) Người lao động không có mặt tại nơi làm việc sau thời hạn tạm hoãn hợp đồng; đ) Người lao động đủ tuổi nghỉ hưu; e) Người lao động tự ý bỏ việc mà không có lý do chính đáng từ 05 ngày làm việc liên tục trở lên; g) Người lao động cung cấp không trung thực thông tin khi giao kết hợp đồng lao động.",
    "requires_refusal": false
  },
  {
    "question_id": "Q007",
    "question": "Người lao động làm thêm giờ vào ngày nghỉ hằng tuần được trả lương tính theo đơn giá tiền lương ít nhất bằng bao nhiêu phần trăm?",
    "category": "single_article",
    "gold_sources": [
      {
        "document_id": "BLLD_2019",
        "article_number": "Điều 98",
        "chunk_ids": [
          "BLLD_2019_Điều98_132"
        ]
      }
    ],
    "reference_answer": "Theo Điều 98 Bộ luật Lao động 2019, người lao động làm thêm giờ được trả lương tính theo đơn giá tiền lương hoặc tiền lương thực trả theo công việc đang làm: vào ngày thường, ít nhất bằng 150%; vào ngày nghỉ hằng tuần, ít nhất bằng 200%; vào ngày nghỉ lễ, tết, ngày nghỉ có hưởng lương, ít nhất bằng 300% chưa kể tiền lương ngày lễ, tết, ngày nghỉ có hưởng lương đối với người lao động hưởng lương ngày.",
    "requires_refusal": false
  },
  {
    "question_id": "Q008",
    "question": "Số ngày nghỉ hằng năm của người lao động làm việc trong điều kiện bình thường đủ 12 tháng cho một người sử dụng lao động là bao nhiêu ngày?",
    "category": "single_article",
    "gold_sources": [
      {
        "document_id": "BLLD_2019",
        "article_number": "Điều 113",
        "chunk_ids": [
          "BLLD_2019_Điều113_Khoản1_149",
          "BLLD_2019_Điều113_Khoản2_150",
          "BLLD_2019_Điều113_Khoản5_151"
        ]
      }
    ],
    "reference_answer": "Căn cứ theo Điều 113 Bộ luật Lao động 2019, người lao động làm việc đủ 12 tháng cho một người sử dụng lao động thì được nghỉ hằng năm, hưởng nguyên lương theo hợp đồng lao động: 12 ngày làm việc đối với người làm công việc trong điều kiện bình thường; 14 ngày làm việc đối với người lao động chưa thành niên, lao động là người khuyết tật, người làm nghề, công việc nặng nhọc, độc hại, nguy hiểm; 16 ngày làm việc đối với người làm nghề, công việc đặc biệt nặng nhọc, độc hại, nguy hiểm.",
    "requires_refusal": false
  },
  {
    "question_id": "Q009",
    "question": "Những hành vi nào bị nghiêm cấm đối với người sử dụng lao động khi xử lý kỷ luật lao động?",
    "category": "single_article",
    "gold_sources": [
      {
        "document_id": "BLLD_2019",
        "article_number": "Điều 127",
        "chunk_ids": [
          "BLLD_2019_Điều127_170"
        ]
      }
    ],
    "reference_answer": "Theo Điều 127 Bộ luật Lao động 2019, các hành vi bị nghiêm cấm khi xử lý kỷ luật lao động bao gồm: 1. Xâm phạm sức khỏe, danh dự, tính mạng, uy tín, nhân phẩm của người lao động; 2. Áp dụng nhiều hình thức xử lý kỷ luật lao động đối với một hành vi vi phạm kỷ luật lao động; 3. Dùng hình thức phạt tiền, cắt lương thay việc xử lý kỷ luật lao động; 4. Xử lý kỷ luật lao động đối với người lao động có hành vi vi phạm không được quy định trong nội quy lao động hoặc không thỏa thuận trong hợp đồng lao động đã giao kết hoặc pháp luật về lao động không có quy định.",
    "requires_refusal": false
  },
  {
    "question_id": "Q010",
    "question": "Thời hạn được xóa kỷ luật lao động đối với người lao động bị khiển trách là bao lâu?",
    "category": "single_article",
    "gold_sources": [
      {
        "document_id": "BLLD_2019",
        "article_number": "Điều 126",
        "chunk_ids": [
          "BLLD_2019_Điều126_169"
        ]
      }
    ],
    "reference_answer": "Theo Điều 126 Bộ luật Lao động 2019, người lao động bị khiển trách sau 03 tháng hoặc bị kéo dài thời hạn nâng lương sau 06 tháng hoặc bị cách chức sau 03 năm kể từ ngày bị xử lý, nếu không tiếp tục vi phạm kỷ luật lao động thì đương nhiên được xóa kỷ luật.",
    "requires_refusal": false
  },
  {
    "question_id": "Q011",
    "question": "Người lao động được nghỉ việc riêng mà vẫn hưởng nguyên lương trong những trường hợp nào?",
    "category": "single_article",
    "gold_sources": [
      {
        "document_id": "BLLD_2019",
        "article_number": "Điều 115",
        "chunk_ids": [
          "BLLD_2019_Điều115_153"
        ]
      }
    ],